{
  "schemaVersion": 1,
  "builds": [
    {
      "schemaVersion": 1,
      "id": "1.2.2.1",
      "displayVersion": "1.2.2.1",
      "depotId": 367521,
      "manifestId": "648876203478229944",
      "executableSha256": "1434454FCB5A1F4FFF329EA56182A7C7DA1581DC0F4B6DCEF8585E739F416217",
      "globalGameManagersSha256": "58BC88B74D6F05B9E00D7E1F2BC9B3BA6E9FC51F75C6915DF10BF10B90CDD749"
    },
    {
      "schemaVersion": 1,
      "id": "1.4.3.2",
      "displayVersion": "1.4.3.2",
      "depotId": 367521,
      "manifestId": "7100970131266256005",
      "executableSha256": "209552122B8A437EB4D0ACA0578DA85408B91C1C35D9137E5F5EEE313F8331BF",
      "unityPlayerSha256": "3AE7AD0A4658406A056D4D0C75E6787A553ABE3D0ADBCA510BFE8BBEC3111C67",
      "globalGameManagersSha256": "2F22CE414944A9C6B8F6CD867F0E14BEE2F4622BED8FBA2CCBC2F389B992181B"
    },
    {
      "schemaVersion": 1,
      "id": "1.5.78.11833",
      "displayVersion": "1.5.78.11833",
      "depotId": 367521,
      "manifestId": "4539921744901848404",
      "executableSha256": "4D3D0F55AFBB249170241D0DC6FAF9A5DCF3E1ED427A282AE990BB6E4E3A6913",
      "unityPlayerSha256": "D97E92A7640B10580B4E60139EACF01828F74BAAEF53F75E08B9FDD6193FBE5E",
      "globalGameManagersSha256": "57EBBD860F452878D82000ED7CAA9D40F22436FFCC1E56088EEC28683C486EFA"
    },
    {
      "schemaVersion": 1,
      "id": "1.5.12620.0",
      "displayVersion": "1.5.12620.0",
      "depotId": 367521,
      "manifestId": "257781644874438846",
      "executableSha256": "7961BBA7243CE322163AD6B0DDFD6EF701413020B92AD0D98502526A396171B0",
      "unityPlayerSha256": "8F2D601F8D3C7F4D29D80BA786C0BE873102BB7E6041EB03964A90B99724D90B",
      "globalGameManagersSha256": "0E9A971C59C072A2DDD5BEDE0B64964F512BDE9596C3583D23E4881BDE35D7F8"
    }
  ],
  "channels": [
    { "schemaVersion": 1, "name": "latest", "buildId": "1.5.12620.0" },
    { "schemaVersion": 1, "name": "public", "buildId": "1.5.12620.0" }
  ],
  "loaders": [
    {
      "schemaVersion": 1,
      "id": "modding-api-37",
      "name": "Modding API",
      "version": "37",
      "downloadUrl": "https://github.com/wzxnb2333/api/releases/download/1.2.2.1-37-windows/ModdingAPI-1.2.2.1-37-win-x64.zip",
      "sizeBytes": 932719,
      "sha256": "ECFF6C73C40194E9D8118C14B9ADE6862DB91E3949D8150027A86FD83BF290F7",
      "supportedBuildIds": ["1.2.2.1"]
    },
    {
      "schemaVersion": 1,
      "id": "bepinex-5.4.23.4",
      "name": "BepInEx",
      "version": "5.4.23.4",
      "downloadUrl": "https://github.com/BepInEx/BepInEx/releases/download/v5.4.23.4/BepInEx_win_x64_5.4.23.4.zip",
      "sizeBytes": 638940,
      "sha256": "F881201B79DA03E513BF97CDF39607FFA7F9E0D31A519B1AEECA8EB60F8309E7",
      "supportedBuildIds": ["1.5.12620.0"]
    },
    {
      "schemaVersion": 1,
      "id": "modding-api-60",
      "name": "Modding API",
      "version": "60",
      "downloadUrl": "https://github.com/hk-modding/api/releases/download/1.4.3.2-60/Windows.zip",
      "sizeBytes": 3623441,
      "sha256": "A84571DE7DD8E0EA2F2528E132359F6F37A3CD161472C104E19D0C9FEA874E51",
      "supportedBuildIds": ["1.4.3.2"]
    },
    {
      "schemaVersion": 1,
      "id": "modding-api-77",
      "name": "Modding API",
      "version": "77",
      "downloadUrl": "https://github.com/hk-modding/api/releases/download/1.5.78.11833-77/moddingapi.v77.windows.zip",
      "sizeBytes": 7024251,
      "sha256": "BC9F0DB3D0916B05CD5A2420BB602FB1B239CE3FF6C289FD84BFFB682FB8F1D6",
      "supportedBuildIds": ["1.5.78.11833"]
    },
    {
      "schemaVersion": 1,
      "id": "modding-api-78",
      "name": "Modding API",
      "version": "78",
      "downloadUrl": "https://github.com/wzxnb2333/api/releases/download/1.5.12620.0-78/ModdingAPI-1.5.12620.0-78-win-x64.zip",
      "sizeBytes": 4982043,
      "sha256": "5B5EBDDA651171E3C5EA6F13FB68FFE2D1B5F8B97A9D6FDE0EED3EA529418748",
      "supportedBuildIds": ["1.5.12620.0"]
    }
  ],
  "mods": [
    {
      "schemaVersion": 1,
      "id": "debugmod-legacy-1.2.2.1",
      "name": "DebugMod Legacy 1.2.2.1",
      "version": "1.4.10.5-r2",
      "downloadUrl": "https://github.com/wzxnb2333/New.HK.Debug/releases/download/v1.4.10.5-r2/DebugMod-Legacy-1.2.2.1.zip",
      "sizeBytes": 1107771,
      "sha256": "B25BE4A843D1010D3F6A54D159A4F6F87A9175DEC31E6B0C625B333F23AA83FB",
      "loaderId": "modding-api-37",
      "supportedBuildIds": ["1.2.2.1"],
      "dependencies": [],
      "flatFiles": ["DebugMod.dll"]
    },
    {
      "schemaVersion": 1,
      "id": "debugmod-legacy-1.4.3.2",
      "name": "DebugMod Legacy 1.4.3.2",
      "version": "1.4.10.5-r2",
      "downloadUrl": "https://github.com/wzxnb2333/New.HK.Debug/releases/download/v1.4.10.5-r2/DebugMod-Legacy-1.4.3.2.zip",
      "sizeBytes": 1114406,
      "sha256": "E386365E73B7EB2547B6C57E25A6174591E768E8715B75F3B619811EF7420318",
      "loaderId": "modding-api-60",
      "supportedBuildIds": ["1.4.3.2"],
      "dependencies": [],
      "flatFiles": ["DebugMod.dll"]
    },
    {
      "schemaVersion": 1,
      "id": "debugmod-legacy-1.5.78",
      "name": "DebugMod Legacy 1.5.78",
      "version": "1.4.10.5-r2",
      "downloadUrl": "https://github.com/wzxnb2333/New.HK.Debug/releases/download/v1.4.10.5-r2/DebugMod-Legacy-1.5.78.zip",
      "sizeBytes": 1115153,
      "sha256": "136C768BDE57A8864CB089E1471C554CFC88218F23229D1A39A56B032A2B7D75",
      "loaderId": "modding-api-77",
      "supportedBuildIds": ["1.5.78.11833"],
      "dependencies": []
    },
    {
      "schemaVersion": 1,
      "id": "debugmod-unity6-latest",
      "name": "DebugMod Unity 6",
      "version": "1.4.10.5-r2",
      "downloadUrl": "https://github.com/wzxnb2333/New.HK.Debug/releases/download/v1.4.10.5-r2/DebugMod-Unity6-1.5.12620.zip",
      "sizeBytes": 1104691,
      "sha256": "DE988BB70C578D935FD69F028D4C4537253CB7FE23BC6BBCCEFB925D1C2B574F",
      "loaderId": "bepinex-5.4.23.4",
      "supportedBuildIds": ["1.5.12620.0"],
      "dependencies": []
    }
  ],
  "speedrunTemplates": [
    {
      "schemaVersion": 1,
      "id": "runtime-patches-1221",
      "name": "RuntimePatches 1.2.2.1",
      "buildId": "1.2.2.1",
      "isOfficial": true,
      "rulesRevision": "runtime-patches-v1.0.2",
      "fileManifestId": "files-runtime-patches-1221",
      "requiredAssetIds": ["runtime-patches-1221-v1.0.2"],
      "loadNormaliserAvailable": false,
      "requiresLoadNormaliserSelection": false,
      "allowedLoadNormaliserSeconds": []
    },
    {
      "schemaVersion": 1,
      "id": "runtime-patches-1432",
      "name": "RuntimePatches 1.4.3.2",
      "buildId": "1.4.3.2",
      "isOfficial": true,
      "rulesRevision": "runtime-patches-v1.0.2",
      "fileManifestId": "files-runtime-patches-1432",
      "requiredAssetIds": ["runtime-patches-1432-v1.0.2"],
      "loadNormaliserAvailable": false,
      "requiresLoadNormaliserSelection": false,
      "allowedLoadNormaliserSeconds": []
    },
    {
      "schemaVersion": 1,
      "id": "runtime-patches-1578",
      "name": "RuntimePatches 1.5.78",
      "buildId": "1.5.78.11833",
      "isOfficial": true,
      "rulesRevision": "runtime-patches-v1.0.2",
      "fileManifestId": "files-runtime-patches-1578",
      "requiredAssetIds": ["runtime-patches-1578-v1.0.2"],
      "loadNormaliserAvailable": false,
      "requiresLoadNormaliserSelection": false,
      "allowedLoadNormaliserSeconds": []
    }
  ],
  "speedrunAssets": [
    {
      "schemaVersion": 1,
      "id": "runtime-patches-1221-v1.0.2",
      "name": "AssemblyPatches",
      "version": "1.0.2",
      "downloadUrl": "https://github.com/olvior/AssemblyPatches/releases/download/v1.0.2/Assembly-CSharp-1221-windows.zip",
      "sizeBytes": 876481,
      "sha256": "5F603C92E1E94F3FA1CBF59CC75AADCBD8E6014F7AC39D4F3F5924F945D85FC6",
      "supportedBuildIds": ["1.2.2.1"]
    },
    {
      "schemaVersion": 1,
      "id": "runtime-patches-1432-v1.0.2",
      "name": "AssemblyPatches",
      "version": "1.0.2",
      "downloadUrl": "https://github.com/olvior/AssemblyPatches/releases/download/v1.0.2/Assembly-CSharp-1432-windows.zip",
      "sizeBytes": 1128984,
      "sha256": "2ED1D9AE636EA177F97CE5C4565DFA4FA102E22B10F82D49201086A8F706FC3E",
      "supportedBuildIds": ["1.4.3.2"]
    },
    {
      "schemaVersion": 1,
      "id": "runtime-patches-1578-v1.0.2",
      "name": "AssemblyPatches",
      "version": "1.0.2",
      "downloadUrl": "https://github.com/olvior/AssemblyPatches/releases/download/v1.0.2/Assembly-CSharp-1578-windows.zip",
      "sizeBytes": 1129878,
      "sha256": "5E4380B70C27DA8E512E0C177A9A6C4742A615216330D343535AF8D48BA8AA3D",
      "supportedBuildIds": ["1.5.78.11833"]
    }
  ],
  "speedrunFileManifests": [
    {
      "schemaVersion": 1,
      "id": "files-runtime-patches-1221",
      "buildId": "1.2.2.1",
      "rulesRevision": "runtime-patches-v1.0.2",
      "files": [
        {
          "relativePath": "hollow_knight_Data/Managed/Assembly-CSharp.dll",
          "sha256": "A47DA658E488127B58AEF4469BB8205E90038D0E24ACE12E873B493510DA071F",
          "kind": "tool",
          "assetId": "runtime-patches-1221-v1.0.2",
          "assetVersion": "1.0.2"
        }
      ]
    },
    {
      "schemaVersion": 1,
      "id": "files-runtime-patches-1432",
      "buildId": "1.4.3.2",
      "rulesRevision": "runtime-patches-v1.0.2",
      "files": [
        {
          "relativePath": "hollow_knight_Data/Managed/Assembly-CSharp.dll",
          "sha256": "F9EEE63FD3AB9531BF91BDD1EB77B49E873114443C7D85C3124CDF871317BFFD",
          "kind": "tool",
          "assetId": "runtime-patches-1432-v1.0.2",
          "assetVersion": "1.0.2"
        }
      ]
    },
    {
      "schemaVersion": 1,
      "id": "files-runtime-patches-1578",
      "buildId": "1.5.78.11833",
      "rulesRevision": "runtime-patches-v1.0.2",
      "files": [
        {
          "relativePath": "hollow_knight_Data/Managed/Assembly-CSharp.dll",